{
  "meta": { "version": "0.1.0", "owner": "design-system-team" },
  "color": {
    "text": {
      "primary": { "value": "#0B1B2B", "comment": "body text" },
      "muted": { "value": "#6B7280", "comment": "secondary text" }
    },
    "interactive": {
      "primary": { "value": "#0A84FF", "comment": "primary actions" }
    },
    "bg": {
      "page": { "value": "#FFFFFF" },
      "card": { "value": "#F8FAFC" }
    },
    "state": {
      "success": { "value": "#16A34A" },
      "danger": { "value": "#EF4444" }
    }
  },
  "type": {
    "heading": {
      "h1": { "size": "32px", "weight": 700, "lineHeight": "40px" },
      "h2": { "size": "24px", "weight": 600, "lineHeight": "32px" }
    },
    "body": { "regular": { "size": "16px", "lineHeight": "24px" } }
  },
  "space": {
    "1": { "value": "4px" },
    "2": { "value": "8px" },
    "3": { "value": "12px" },
    "4": { "value": "16px" }
  },
  "radius": { "sm": { "value": "4px" }, "md": { "value": "8px" } },
  "motion": {
    "duration": { "fast": { "value": "120ms" }, "normal": { "value": "240ms" } },
    "easing": { "value": "cubic-bezier(0.4,0,0.2,1)" }
  }
}